{
  "metadata": {
    "version": "2.0.0",
    "created_at": "2024-08-15T14:30:00Z",
    "source_audio": "/path/to/song.wav",
    "processing_tool": "Song Editor 2",
    "confidence_threshold": 0.7,
    "whisper_model": "openai-whisper",
    "alternatives_count": 2
  },
  "words": [
    {
      "text": "Hello",
      "start": 0.5,
      "end": 0.8,
      "confidence": 0.95,
      "alternatives": [
        {
          "text": "Hello",
          "confidence": 0.95
        },
        {
          "text": "Hallo",
          "confidence": 0.85
        }
      ],
      "chord": {
        "symbol": "C",
        "root": "C",
        "quality": "maj",
        "bass": null,
        "confidence": 0.88
      }
    },
    {
      "text": "world",
      "start": 0.8,
      "end": 1.2,
      "confidence": 0.92,
      "alternatives": [
        {
          "text": "world",
          "confidence": 0.92
        },
        {
          "text": "word",
          "confidence": 0.78
        }
      ],
      "chord": {
        "symbol": "Am",
        "root": "A",
        "quality": "min",
        "bass": null,
        "confidence": 0.85
      }
    },
    {
      "text": "how",
      "start": 1.2,
      "end": 1.5,
      "confidence": 0.89,
      "chord": {
        "symbol": "F",
        "root": "F",
        "quality": "maj",
        "bass": null,
        "confidence": 0.82
      }
    },
    {
      "text": "are",
      "start": 1.5,
      "end": 1.8,
      "confidence": 0.91,
      "chord": {
        "symbol": "G",
        "root": "G",
        "quality": "maj",
        "bass": null,
        "confidence": 0.87
      }
    },
    {
      "text": "you",
      "start": 1.8,
      "end": 2.2,
      "confidence": 0.94,
      "chord": {
        "symbol": "C",
        "root": "C",
        "quality": "maj",
        "bass": null,
        "confidence": 0.90
      }
    }
  ],
  "chords": [
    {
      "symbol": "C",
      "root": "C",
      "quality": "maj",
      "bass": null,
      "start": 0.0,
      "end": 0.8,
      "confidence": 0.88
    },
    {
      "symbol": "Am",
      "root": "A",
      "quality": "min",
      "bass": null,
      "start": 0.8,
      "end": 1.2,
      "confidence": 0.85
    },
    {
      "symbol": "F",
      "root": "F",
      "quality": "maj",
      "bass": null,
      "start": 1.2,
      "end": 1.5,
      "confidence": 0.82
    },
    {
      "symbol": "G",
      "root": "G",
      "quality": "maj",
      "bass": null,
      "start": 1.5,
      "end": 1.8,
      "confidence": 0.87
    },
    {
      "symbol": "C",
      "root": "C",
      "quality": "maj",
      "bass": null,
      "start": 1.8,
      "end": 2.5,
      "confidence": 0.90
    }
  ],
  "notes": [
    {
      "pitch_midi": 60,
      "pitch_name": "C4",
      "start": 0.5,
      "end": 0.8,
      "velocity": 80,
      "confidence": 0.85
    },
    {
      "pitch_midi": 64,
      "pitch_name": "E4",
      "start": 0.8,
      "end": 1.2,
      "velocity": 75,
      "confidence": 0.82
    },
    {
      "pitch_midi": 67,
      "pitch_name": "G4",
      "start": 1.2,
      "end": 1.5,
      "velocity": 78,
      "confidence": 0.88
    }
  ],
  "segments": [
    {
      "type": "intro",
      "label": "Introduction",
      "start": 0.0,
      "end": 0.5,
      "confidence": 0.95
    },
    {
      "type": "verse",
      "label": "Verse 1",
      "start": 0.5,
      "end": 2.2,
      "confidence": 0.92
    }
  ]
}
